{
  "schemaVersion": 1,
  "hero": {
    "title": "ORCID 是為了…"
  },
  "audiences": [
    {
      "id": "researchers",
      "label": "研究人員",
      "background": "assets/kaya_background-8976686500.png",
      "intro": "ORCID 是一個免費、唯一且永久的識別碼 (PID)，供個人在參與研究、學術和創新活動時使用。了解如何 ORCID 可以幫助您花更多時間進行研究，減少管理時間。 [進一步了解 ORCID 面向研究人員。](https://info.orcid.org/researchers)",
      "features": [
        {
          "id": "uniquely-yours",
          "icon": "assets/account_circle-de74c17d9a.png",
          "title": "獨一無二的你",
          "body": "無論有多少人擁有與您相同（或相似）的名字，都可以讓您脫穎而出並為您的工作贏得榮譽。 [在此註冊。](https://orcid.org/register)"
        },
        {
          "id": "portable-profile-data",
          "icon": "assets/laptop_windows-a774fe5378.png",
          "title": "便攜式配置文件數據",
          "body": "在您的記錄和資助、出版物、資料儲存庫和其他研究工作流程之間輕鬆共享資料。"
        }
      ]
    },
    {
      "id": "universities-research-institutes",
      "label": "大學及科研院所",
      "background": "assets/kaya_background-8976686500.png",
      "intro": "ORCID 使大學和研究機構能夠及時了解其研究人員的成果，減少管理負擔和輸入錯誤，並幫助他們的研究人員、博士後、員工和學生提高其工作成果的可發現性。 [進一步了解 ORCID 適用於大學和研究機構。](https://info.orcid.org/orcid-for-universities-and-research-institutions/)",
      "features": [
        {
          "id": "support-research-productivity",
          "icon": "assets/biotech-d88f0eca52.png",
          "title": "支持研究生產力",
          "body": "透過減輕管理負擔，讓您的研究人員將更多時間花在研究上"
        },
        {
          "id": "track-careers",
          "icon": "assets/school-c6c8b41dec.png",
          "title": "追蹤職業生涯",
          "body": "追蹤研究人員和畢業生離開您的機構以及其他機構的合作者和同行後的職業生涯。"
        }
      ]
    },
    {
      "id": "publishers",
      "label": "出版商",
      "background": "assets/kaya_background-8976686500.png",
      "intro": "與以下平台整合的發布商 ORCID 可以簡化作者、編輯和審閱者的工作流程。 ORCID 提高書籍和期刊對社群的整體價值，幫助確保出版商能更好地留住作者和讀者。 [進一步了解 ORCID 面向出版商。](https://info.orcid.org/orcid-for-publishers/)",
      "features": [
        {
          "id": "know-your-authors",
          "icon": "assets/data_loss_prevention-38e990a14b.png",
          "title": "了解你的作者",
          "body": "更了解您的作者、共同作者和審查員是誰，並提高提交、審查和報告流程的完整性。"
        },
        {
          "id": "portable-profile-data",
          "icon": "assets/laptop_windows-a774fe5378.png",
          "title": "便攜式配置文件數據",
          "body": "在您的記錄和資助、出版物、資料儲存庫和其他研究工作流程之間輕鬆共享資料。"
        }
      ]
    },
    {
      "id": "vendors-service-providers",
      "label": "供應商和服務提供者",
      "background": "assets/kaya_background-8976686500.png",
      "intro": "供應商和服務提供者將其服務連接到 ORCID 註冊中心加入我們的生態系統，擁有超過 5,000 個 ORCID整合系統。提供這項服務可以增加他們透過權威、高品質的個人資料數據為學術界提供的價值。 [進一步了解 ORCID 適用於供應商和服務提供者。](https://info.orcid.org/vendors-and-service-providers/)",
      "features": [
        {
          "id": "increase-roi",
          "icon": "assets/query_stats-6378deb876.png",
          "title": "增加投資回報率",
          "body": "提高平台的投資報酬率並為您合作的組織提供更好的見解。"
        },
        {
          "id": "improve-discoverability",
          "icon": "assets/visibility-17e367a28a.png",
          "title": "提高可發現性",
          "body": "透過權威、高品質的個人資料數據增加您為學術界提供的價值。"
        }
      ]
    },
    {
      "id": "government-policy-makers",
      "label": "政府和政策制定者",
      "background": "assets/kaya_background-8976686500.png",
      "intro": "ORCID 整合系統減輕了研究資助機構和授予資源使用權的主要機構的行政負擔。透過減少管理獎項所需的時間和精力，他們可以更好地衡量獎項的影響。 [進一步了解 ORCID 對於政府和政策制定者](https://info.orcid.org/orcid-for-funders-and-facilities/) .",
      "features": [
        {
          "id": "know-your-researchers",
          "icon": "assets/person_check-7860cac6f4.png",
          "title": "了解你的研究人員",
          "body": "更了解您的研究人員是誰，並提高評估和報告流程的完整性。"
        },
        {
          "id": "align-research-strategy",
          "icon": "assets/language-c7d2849081.png",
          "title": "調整研究策略",
          "body": "更好地使您的研究、PID 或基礎設施策略與全球社區標準保持一致"
        }
      ]
    },
    {
      "id": "funders-facilities",
      "label": "資助者和設施",
      "background": "assets/kaya_background-8976686500.png",
      "intro": "ORCID 整合系統減輕了研究資助機構和授予資源使用權的主要機構的行政負擔。透過減少管理獎項所需的時間和精力，他們可以更好地衡量獎項的影響。 [進一步了解 ORCID 對於資助者](https://info.orcid.org/orcid-for-funders-and-facilities/).",
      "features": [
        {
          "id": "know-your-researchers",
          "icon": "assets/person_check-7860cac6f4.png",
          "title": "了解你的研究人員",
          "body": "更了解您的申請人和審閱者是誰，並提高提交、審查和報告流程的完整性"
        },
        {
          "id": "track-your-impact",
          "icon": "assets/query_stats-6378deb876.png",
          "title": "追蹤您的影響",
          "body": "提高您追蹤獎項和獲獎者影響的能力，甚至在績效期間之外也是如此。"
        }
      ]
    }
  ],
  "featuredNews": {
    "kicker": "精選新聞",
    "title": "研究人員：了解你的 ORCID 唱片能為你做什麼",
    "body": "管理跨不同系統、機構和職業生涯階段的研究工作可能會讓人筋疲力盡。 ORCID 無論您的職業生涯、學科領域或地理如何，我們都將竭誠為您服務，幫助研究人員維護值得信賴且緊密聯繫的研究身份，從而讓他們有更多時間專注於研究。一旦您與您信任並合作的機構建立已驗證的聯繫，即可允許他們添加您的資料。您也可以使用您的 ID 登入其他系統、自動填寫表單以及跨平台同步您的資料。 [觀看這段短視頻，了解更多關於您的信息 ORCID 記錄能為你做什麼](https://www.youtube.com/watch?v=1rZvFGLe7bg).",
    "vimeoId": "1198760040"
  },
  "integrate": {
    "title": "與整合 ORCID 為了更強大、更穩健的研究生態系統",
    "paragraphs": [
      {
        "id": "hub",
        "body": "從僱傭關係、研究成果、資金來源、同儕審查活動、研究資源等等方面， ORCID 將人們與他們的研究活動聯繫起來。 [瀏覽 ORCID工作流程和集成](https://info.orcid.org/documentation/)."
      },
      {
        "id": "certified-service-providers",
        "body": "發現 ORCID為學術服務提供者提供支持，包括撥款/設施申請管理系統、稿件提交系統、儲存庫系統、研究資訊系統和發現系統。 [查看我們完整的認證雲端服務提供者列表](https://info.orcid.org/vendors-and-service-providers/orcid-certified-service-providers-list/)."
      },
      {
        "id": "getting-started",
        "body": "入門 ORCID 比看起來容易。 [閱讀我們的 ORCID 研究人員頁面](https://info.orcid.org/researchers/) 了解常見問題的答案 [註冊一個 ORCID 今日記錄](https://orcid.org/signin)."
      }
    ]
  },
  "meta": {
    "locale": "zh-TW",
    "version": "qa-9aea4b9",
    "commit": "9aea4b9",
    "generatedAt": "2026-09-05T16:56:33.541Z",
    "translated": 44,
    "total": 44
  }
}
